{
  "id": "01jb90a1b2c3d4e5f6g7h8j9km",
  "classification": "internal",
  "boundary": "globex",
  "clientId": "globex",
  "title": "Rotate the expiring deploy key",
  "state": "todo",
  "priority": "normal",
  "effort": "XS",
  "businessValue": "medium",
  "scheduledFor": "2026-10-26",
  "rank": "a0",
  "kind": "admin",
  "revision": 1,
  "createdAt": "2026-10-24T09:00:00Z",
  "updatedAt": "2026-10-24T09:00:00Z"
}
